{
  "schema_version": "0.1.0",
  "source_id": "x-astronaut_1216-535eb07daec0",
  "fetched_at": "2026-03-25T07:23:48Z",
  "platform": "x",
  "source_kind": "x_thread",
  "canonical_url": "https://x.com/Astronaut_1216/status/2036355590746685722",
  "author": {
    "handle": "@Astronaut_1216",
    "display_name": "Astronaut_1216",
    "account_url": "https://x.com/Astronaut_1216"
  },
  "title": "建议你们警惕任何一个不发推的人 因为这帮人肯定在偷偷地赚钱 我算是意识到了 一旦我日更超过5条 就意味着我没有在赚钱 真正在做事的人是没有时间做自媒体的",
  "language": "unknown",
  "published_at": "2026-03-24T08:13:01Z",
  "participants": [],
  "source_assets": [
    {
      "asset_kind": "x_status",
      "url": "https://x.com/Astronaut_1216/status/2036355590746685722",
      "selected_for_text": true,
      "notes": "primary social source"
    },
    {
      "asset_kind": "nitter_rss_item",
      "url": "https://nitter.net/Astronaut_1216/status/2036355590746685722#m",
      "selected_for_text": false,
      "notes": "guest-mode rss origin"
    }
  ],
  "content": {
    "primary_text_source": "x_post",
    "summary": "建议你们警惕任何一个不发推的人 因为这帮人肯定在偷偷地赚钱 我算是意识到了 一旦我日更超过5条 就意味着我没有在赚钱 真正在做事的人是没有时间做自媒体的",
    "full_text": "Post title: 建议你们警惕任何一个不发推的人 因为这帮人肯定在偷偷地赚钱 我算是意识到了 一旦我日更超过5条 就意味着我没有在赚钱 真正在做事的人是没有时间做自媒体的\n\nPost summary: 建议你们警惕任何一个不发推的人 因为这帮人肯定在偷偷地赚钱 我算是意识到了 一旦我日更超过5条 就意味着我没有在赚钱 真正在做事的人是没有时间做自媒体的\n\nCanonical URL: https://x.com/Astronaut_1216/status/2036355590746685722",
    "sections": [
      "x_post"
    ],
    "raw_quotes": [],
    "assembly_notes": null
  },
  "extracted_signals": {
    "release_signals": [],
    "metric_signals": [],
    "named_entities": [
      "Post",
      "Canonical URL"
    ],
    "task_hints": [],
    "fact_anchors": [
      "建议你们警惕任何一个不发推的人 因为这帮人肯定在偷偷地赚钱 我算是意识到了 一旦我日更超过5条 就意味着我没有在赚钱 真正在做事的人是没有时间做自媒体的",
      "Post",
      "Canonical URL"
    ],
    "normalization_notes": "linked_context_count=0"
  }
}
