{
  "schema_version": "0.1.0",
  "source_id": "x-ivanfioravanti-914e3cfe1ab3",
  "fetched_at": "2026-03-25T07:23:48Z",
  "platform": "x",
  "source_kind": "x_thread",
  "canonical_url": "https://x.com/ivanfioravanti/status/2036420137738256783",
  "author": {
    "handle": "@ivanfioravanti",
    "display_name": "ivanfioravanti",
    "account_url": "https://x.com/ivanfioravanti"
  },
  "title": "All my benchmarks so far were not leveraging cache, but in the real world scenarios you don't start with a 128K context, you go up incrementally, so TTFT must take KV Cache into account. Adding this aspect to my long context benchmarks. Stay tuned 🚀",
  "language": "unknown",
  "published_at": "2026-03-24T12:29:30Z",
  "participants": [],
  "source_assets": [
    {
      "asset_kind": "x_status",
      "url": "https://x.com/ivanfioravanti/status/2036420137738256783",
      "selected_for_text": true,
      "notes": "primary social source"
    },
    {
      "asset_kind": "nitter_rss_item",
      "url": "https://nitter.net/ivanfioravanti/status/2036420137738256783#m",
      "selected_for_text": false,
      "notes": "guest-mode rss origin"
    }
  ],
  "content": {
    "primary_text_source": "x_post",
    "summary": "All my benchmarks so far were not leveraging cache, but in the real world scenarios you don't start with a 128K context, you go up incrementally, so TTFT must take KV Cache into account. Adding this aspect to my long context benchmarks. Stay tuned 🚀",
    "full_text": "Post title: All my benchmarks so far were not leveraging cache, but in the real world scenarios you don't start with a 128K context, you go up incrementally, so TTFT must take KV Cache into account. Adding this aspect to my long context benchmarks. Stay tuned 🚀\n\nPost summary: All my benchmarks so far were not leveraging cache, but in the real world scenarios you don't start with a 128K context, you go up incrementally, so TTFT must take KV Cache into account. Adding this aspect to my long context benchmarks. Stay tuned 🚀\n\nCanonical URL: https://x.com/ivanfioravanti/status/2036420137738256783",
    "sections": [
      "x_post"
    ],
    "raw_quotes": [],
    "assembly_notes": null
  },
  "extracted_signals": {
    "release_signals": [],
    "metric_signals": [
      "128K"
    ],
    "named_entities": [
      "All",
      "TTFT",
      "KV Cache",
      "Adding",
      "Stay",
      "Post",
      "Canonical URL"
    ],
    "task_hints": [],
    "fact_anchors": [
      "All my benchmarks so far were not leveraging cache, but in the real world scenarios you don't start with a 128K context, you go up incrementally, so TTFT must take KV Cache into account. Adding this aspect to my long context benchmarks. Stay tuned 🚀",
      "128K",
      "All",
      "TTFT",
      "KV Cache",
      "Adding",
      "Stay",
      "Post",
      "Canonical URL"
    ],
    "normalization_notes": "linked_context_count=0"
  }
}
