{
  "schema_version": "0.1.0",
  "source_id": "x-balconychy-949e3a162692",
  "fetched_at": "2026-03-25T07:23:48Z",
  "platform": "x",
  "source_kind": "x_thread",
  "canonical_url": "https://x.com/balconychy/status/2036343850072154523",
  "author": {
    "handle": "@balconychy",
    "display_name": "balconychy",
    "account_url": "https://x.com/balconychy"
  },
  "title": "Gemini也在测试聊天界面里的“生成式UI”。 直接写个网页插件来给你测试学习。",
  "language": "unknown",
  "published_at": "2026-03-24T07:26:21Z",
  "participants": [],
  "source_assets": [
    {
      "asset_kind": "x_status",
      "url": "https://x.com/balconychy/status/2036343850072154523",
      "selected_for_text": true,
      "notes": "primary social source"
    },
    {
      "asset_kind": "nitter_rss_item",
      "url": "https://nitter.net/balconychy/status/2036343850072154523#m",
      "selected_for_text": false,
      "notes": "guest-mode rss origin"
    }
  ],
  "content": {
    "primary_text_source": "x_post",
    "summary": "Gemini也在测试聊天界面里的“生成式UI”。 直接写个网页插件来给你测试学习。",
    "full_text": "Post title: Gemini也在测试聊天界面里的“生成式UI”。 直接写个网页插件来给你测试学习。\n\nPost summary: Gemini也在测试聊天界面里的“生成式UI”。 直接写个网页插件来给你测试学习。\n\nCanonical URL: https://x.com/balconychy/status/2036343850072154523",
    "sections": [
      "x_post"
    ],
    "raw_quotes": [],
    "assembly_notes": null
  },
  "extracted_signals": {
    "release_signals": [],
    "metric_signals": [],
    "named_entities": [
      "Post",
      "Canonical URL"
    ],
    "task_hints": [],
    "fact_anchors": [
      "Gemini也在测试聊天界面里的“生成式UI”。 直接写个网页插件来给你测试学习。",
      "Post",
      "Canonical URL"
    ],
    "normalization_notes": "linked_context_count=0"
  }
}
