{
  "schema_version": "0.1.0",
  "source_id": "x-itsandrewgao-2ac9a1733426",
  "fetched_at": "2026-03-24T07:40:13Z",
  "platform": "x",
  "source_kind": "x_thread",
  "canonical_url": "https://x.com/itsandrewgao/status/2035107169188945992",
  "author": {
    "handle": "@itsandrewgao",
    "display_name": "itsandrewgao",
    "account_url": "https://x.com/itsandrewgao"
  },
  "title": "just a few of the ways you can use the Devin API! Github Actions + Devin API is particularly simple to setup + surprisingly expressive",
  "language": "unknown",
  "published_at": "2026-03-20T21:32:14Z",
  "participants": [],
  "source_assets": [
    {
      "asset_kind": "x_status",
      "url": "https://x.com/itsandrewgao/status/2035107169188945992",
      "selected_for_text": true,
      "notes": "primary social source"
    },
    {
      "asset_kind": "nitter_rss_item",
      "url": "https://nitter.net/itsandrewgao/status/2035107169188945992#m",
      "selected_for_text": false,
      "notes": "guest-mode rss origin"
    }
  ],
  "content": {
    "primary_text_source": "x_post",
    "summary": "just a few of the ways you can use the Devin API! Github Actions + Devin API is particularly simple to setup + surprisingly expressive Scott Wu (@ScottWu46) This week 70% of all Devins were started by humans (webapp, slack, linear) and 30% were started automatically (API, and now scheduled + managed Devins) In a few months that probably flips to 30/70 the other way and within a year it'll be 10/90. What does it look like to run a truly agent-native dev team? -Handing whole project specs to a top-level agent that manages its subagents to do the groundwork -Agents that kick off automatically on Sentry/Datadog alerts and as first-line incident-response -Agents continuously running integration test / QA workflows and auto-investigating UX changes or performance issues And of course, all of the \"eng scaffolding\" needed to make this possible - comprehensive unit testing, good documentation, and a reproducible dev environment. — https://nitter.net/ScottWu46/status/2035106171984773508#m",
    "full_text": "Post title: just a few of the ways you can use the Devin API! Github Actions + Devin API is particularly simple to setup + surprisingly expressive\n\nPost summary: just a few of the ways you can use the Devin API! Github Actions + Devin API is particularly simple to setup + surprisingly expressive Scott Wu (@ScottWu46) This week 70% of all Devins were started by humans (webapp, slack, linear) and 30% were started automatically (API, and now scheduled + managed Devins) In a few months that probably flips to 30/70 the other way and within a year it'll be 10/90. What does it look like to run a truly agent-native dev team? -Handing whole project specs to a top-level agent that manages its subagents to do the groundwork -Agents that kick off automatically on Sentry/Datadog alerts and as first-line incident-response -Agents continuously running integration test / QA workflows and auto-investigating UX changes or performance issues And of course, all of the \"eng scaffolding\" needed to make this possible - comprehensive unit testing, good documentation, and a reproducible dev environment. — https://nitter.net/ScottWu46/status/2035106171984773508#m\n\nCanonical URL: https://x.com/itsandrewgao/status/2035107169188945992",
    "sections": [
      "x_post"
    ],
    "raw_quotes": [],
    "assembly_notes": null
  },
  "extracted_signals": {
    "release_signals": [],
    "metric_signals": [
      "70%",
      "30%"
    ],
    "named_entities": [
      "Devin API",
      "Github Actions",
      "Scott Wu",
      "ScottWu46",
      "This",
      "Devins",
      "API",
      "In",
      "What",
      "Handing",
      "Agents",
      "Sentry",
      "Datadog",
      "QA",
      "UX",
      "Post",
      "Canonical URL"
    ],
    "task_hints": [],
    "fact_anchors": [
      "just a few of the ways you can use the Devin API! Github Actions + Devin API is particularly simple to setup + surprisingly expressive",
      "just a few of the ways you can use the Devin API! Github Actions + Devin API is particularly simple to setup + surprisingly expressive Scott Wu (@ScottWu46) This week 70% of all Devins were started by humans (webapp, slack, linear) and 30% were started automatically (API, and now scheduled + managed Devins) In a few months that probably flips to 30/70 the other way and within a year it'll be 10/90. What does it look like to run a truly agent-native dev team? -Handing whole project specs to a top-level agent that manages its subagents to do the groundwork -Agents that kick off automatically on Sentry/Datadog alerts and as first-line incident-response -Agents continuously running integration test / QA workflows and auto-investigating UX changes or performance issues And of course, all of the \"eng scaffolding\" needed to make this possible - comprehensive unit testing, good documentation, and a reproducible dev environment. — https://nitter.net/ScottWu46/status/2035106171984773508#m",
      "70%",
      "30%",
      "Devin API",
      "Github Actions",
      "Scott Wu",
      "ScottWu46",
      "This",
      "Devins",
      "API",
      "In",
      "What",
      "Handing",
      "Agents",
      "Sentry",
      "Datadog",
      "QA",
      "UX",
      "Post"
    ],
    "normalization_notes": "linked_context_count=0"
  }
}
