{
  "schema_version": "0.1.0",
  "source_id": "x-runwayml-ed92531f2aae",
  "fetched_at": "2026-03-25T07:23:48Z",
  "platform": "x",
  "source_kind": "x_thread",
  "canonical_url": "https://x.com/runwayml/status/2036445630134886846",
  "author": {
    "handle": "@runwayml",
    "display_name": "Runway",
    "account_url": "https://x.com/runwayml"
  },
  "title": "Submissions for the 2026 AI Festival are now open until April 20th. This year's festival will celebrate works utilizing AI across Film, Design, New Media, Fashion, Advertising and Gaming. Learn more and submit your project at the link below.",
  "language": "unknown",
  "published_at": "2026-03-24T14:10:48Z",
  "participants": [],
  "source_assets": [
    {
      "asset_kind": "x_status",
      "url": "https://x.com/runwayml/status/2036445630134886846",
      "selected_for_text": true,
      "notes": "primary social source"
    },
    {
      "asset_kind": "nitter_rss_item",
      "url": "https://nitter.net/runwayml/status/2036445630134886846#m",
      "selected_for_text": false,
      "notes": "guest-mode rss origin"
    }
  ],
  "content": {
    "primary_text_source": "x_post",
    "summary": "Submissions for the 2026 AI Festival are now open until April 20th. This year's festival will celebrate works utilizing AI across Film, Design, New Media, Fashion, Advertising and Gaming. Learn more and submit your project at the link below. Video",
    "full_text": "Post title: Submissions for the 2026 AI Festival are now open until April 20th. This year's festival will celebrate works utilizing AI across Film, Design, New Media, Fashion, Advertising and Gaming. Learn more and submit your project at the link below.\n\nPost summary: Submissions for the 2026 AI Festival are now open until April 20th. This year's festival will celebrate works utilizing AI across Film, Design, New Media, Fashion, Advertising and Gaming. Learn more and submit your project at the link below. Video\n\nCanonical URL: https://x.com/runwayml/status/2036445630134886846",
    "sections": [
      "x_post"
    ],
    "raw_quotes": [],
    "assembly_notes": null
  },
  "extracted_signals": {
    "release_signals": [],
    "metric_signals": [],
    "named_entities": [
      "Submissions",
      "AI Festival",
      "April",
      "This",
      "AI",
      "Film",
      "Design",
      "New Media",
      "Fashion",
      "Advertising",
      "Gaming",
      "Learn",
      "Video Post",
      "Post",
      "Video Canonical URL"
    ],
    "task_hints": [],
    "fact_anchors": [
      "Submissions for the 2026 AI Festival are now open until April 20th. This year's festival will celebrate works utilizing AI across Film, Design, New Media, Fashion, Advertising and Gaming. Learn more and submit your project at the link below.",
      "Submissions for the 2026 AI Festival are now open until April 20th. This year's festival will celebrate works utilizing AI across Film, Design, New Media, Fashion, Advertising and Gaming. Learn more and submit your project at the link below. Video",
      "Submissions",
      "AI Festival",
      "April",
      "This",
      "AI",
      "Film",
      "Design",
      "New Media",
      "Fashion",
      "Advertising",
      "Gaming",
      "Learn",
      "Video Post",
      "Post",
      "Video Canonical URL"
    ],
    "normalization_notes": "linked_context_count=0"
  }
}
