{
  "schema_version": "0.1.0",
  "source_id": "x-alphasignalai-b650ec960edf",
  "fetched_at": "2026-03-24T07:40:13Z",
  "platform": "x",
  "source_kind": "x_thread",
  "canonical_url": "https://x.com/AlphaSignalAI/status/2034963567590474185",
  "author": {
    "handle": "@AlphaSignalAI",
    "display_name": "AlphaSignalAI",
    "account_url": "https://x.com/AlphaSignalAI"
  },
  "title": "ByteDance just gave each agent its own computer. DeerFlow is a new open-source agent framework. It orchestrates multiple AI agents with memory, sandboxes, and modular skills. > Researches, codes, and builds websites > Runs bash commands inside Docker > Spawns parallel sub-agents per task > Remembers you across sessions One prompt triggers a chain. A lead agent breaks the task. Sub-agents run in parallel. Results merge. You get a complete deliverable. Skills load only when needed, keeping context windows lean. Until now, multi-agent systems either shared one messy context or required brittle orchestration code. DeerFlow treats agents like workers: isolated, specialized, and reporting back structured results to a lead agent that synthesizes everything. It works with GPT-4, Claude, Gemini, DeepSeek, or any OpenAI-compatible API. MIT license. 100% open-source.",
  "language": "unknown",
  "published_at": "2026-03-20T12:01:36Z",
  "participants": [],
  "source_assets": [
    {
      "asset_kind": "x_status",
      "url": "https://x.com/AlphaSignalAI/status/2034963567590474185",
      "selected_for_text": true,
      "notes": "primary social source"
    },
    {
      "asset_kind": "nitter_rss_item",
      "url": "https://nitter.net/AlphaSignalAI/status/2034963567590474185#m",
      "selected_for_text": false,
      "notes": "guest-mode rss origin"
    }
  ],
  "content": {
    "primary_text_source": "x_post",
    "summary": "ByteDance just gave each agent its own computer. DeerFlow is a new open-source agent framework. It orchestrates multiple AI agents with memory, sandboxes, and modular skills. &gt; Researches, codes, and builds websites &gt; Runs bash commands inside Docker &gt; Spawns parallel sub-agents per task &gt; Remembers you across sessions One prompt triggers a chain. A lead agent breaks the task. Sub-agents run in parallel. Results merge. You get a complete deliverable. Skills load only when needed, keeping context windows lean. Until now, multi-agent systems either shared one messy context or required brittle orchestration code. DeerFlow treats agents like workers: isolated, specialized, and reporting back structured results to a lead agent that synthesizes everything. It works with GPT-4, Claude, Gemini, DeepSeek, or any OpenAI-compatible API. MIT license. 100% open-source.",
    "full_text": "Post title: ByteDance just gave each agent its own computer. DeerFlow is a new open-source agent framework. It orchestrates multiple AI agents with memory, sandboxes, and modular skills. > Researches, codes, and builds websites > Runs bash commands inside Docker > Spawns parallel sub-agents per task > Remembers you across sessions One prompt triggers a chain. A lead agent breaks the task. Sub-agents run in parallel. Results merge. You get a complete deliverable. Skills load only when needed, keeping context windows lean. Until now, multi-agent systems either shared one messy context or required brittle orchestration code. DeerFlow treats agents like workers: isolated, specialized, and reporting back structured results to a lead agent that synthesizes everything. It works with GPT-4, Claude, Gemini, DeepSeek, or any OpenAI-compatible API. MIT license. 100% open-source.\n\nPost summary: ByteDance just gave each agent its own computer. DeerFlow is a new open-source agent framework. It orchestrates multiple AI agents with memory, sandboxes, and modular skills. &gt; Researches, codes, and builds websites &gt; Runs bash commands inside Docker &gt; Spawns parallel sub-agents per task &gt; Remembers you across sessions One prompt triggers a chain. A lead agent breaks the task. Sub-agents run in parallel. Results merge. You get a complete deliverable. Skills load only when needed, keeping context windows lean. Until now, multi-agent systems either shared one messy context or required brittle orchestration code. DeerFlow treats agents like workers: isolated, specialized, and reporting back structured results to a lead agent that synthesizes everything. It works with GPT-4, Claude, Gemini, DeepSeek, or any OpenAI-compatible API. MIT license. 100% open-source.\n\nCanonical URL: https://x.com/AlphaSignalAI/status/2034963567590474185",
    "sections": [
      "x_post"
    ],
    "raw_quotes": [],
    "assembly_notes": null
  },
  "extracted_signals": {
    "release_signals": [],
    "metric_signals": [
      "100%"
    ],
    "named_entities": [
      "ByteDance",
      "DeerFlow",
      "It",
      "AI",
      "Researches",
      "Runs",
      "Docker",
      "Spawns",
      "Remembers",
      "One",
      "Sub",
      "Results",
      "You",
      "Skills",
      "Until",
      "GPT",
      "Claude",
      "Gemini",
      "DeepSeek",
      "OpenAI",
      "API",
      "MIT",
      "Post",
      "Canonical URL",
      "AlphaSignalAI"
    ],
    "task_hints": [],
    "fact_anchors": [
      "ByteDance just gave each agent its own computer. DeerFlow is a new open-source agent framework. It orchestrates multiple AI agents with memory, sandboxes, and modular skills. > Researches, codes, and builds websites > Runs bash commands inside Docker > Spawns parallel sub-agents per task > Remembers you across sessions One prompt triggers a chain. A lead agent breaks the task. Sub-agents run in parallel. Results merge. You get a complete deliverable. Skills load only when needed, keeping context windows lean. Until now, multi-agent systems either shared one messy context or required brittle orchestration code. DeerFlow treats agents like workers: isolated, specialized, and reporting back structured results to a lead agent that synthesizes everything. It works with GPT-4, Claude, Gemini, DeepSeek, or any OpenAI-compatible API. MIT license. 100% open-source.",
      "ByteDance just gave each agent its own computer. DeerFlow is a new open-source agent framework. It orchestrates multiple AI agents with memory, sandboxes, and modular skills. &gt; Researches, codes, and builds websites &gt; Runs bash commands inside Docker &gt; Spawns parallel sub-agents per task &gt; Remembers you across sessions One prompt triggers a chain. A lead agent breaks the task. Sub-agents run in parallel. Results merge. You get a complete deliverable. Skills load only when needed, keeping context windows lean. Until now, multi-agent systems either shared one messy context or required brittle orchestration code. DeerFlow treats agents like workers: isolated, specialized, and reporting back structured results to a lead agent that synthesizes everything. It works with GPT-4, Claude, Gemini, DeepSeek, or any OpenAI-compatible API. MIT license. 100% open-source.",
      "100%",
      "ByteDance",
      "DeerFlow",
      "It",
      "AI",
      "Researches",
      "Runs",
      "Docker",
      "Spawns",
      "Remembers",
      "One",
      "Sub",
      "Results",
      "You",
      "Skills",
      "Until",
      "GPT"
    ],
    "normalization_notes": "linked_context_count=0"
  }
}
