{
  "schema_version": "0.1.0",
  "source_id": "x-openai-4aa0a9ed510f",
  "fetched_at": "2026-03-25T07:23:48Z",
  "platform": "x",
  "source_kind": "x_thread",
  "canonical_url": "https://x.com/OpenAI/status/2036183180219392103",
  "author": {
    "handle": "@OpenAI",
    "display_name": "OpenAI",
    "account_url": "https://x.com/OpenAI"
  },
  "title": "It’s now easier to find, reuse, and build on the files you upload and create in ChatGPT. You can quickly reference files in a chat using recent files in the toolbar, ask ChatGPT about something you’ve uploaded, or browse your files in the new Library tab in the web sidebar. Rolling out globally for Plus, Pro, and Business users, and coming soon to users in the EEA, Switzerland, and the UK.",
  "language": "unknown",
  "published_at": "2026-03-23T20:47:55Z",
  "participants": [],
  "source_assets": [
    {
      "asset_kind": "x_status",
      "url": "https://x.com/OpenAI/status/2036183180219392103",
      "selected_for_text": true,
      "notes": "primary social source"
    },
    {
      "asset_kind": "nitter_rss_item",
      "url": "https://nitter.net/OpenAI/status/2036183180219392103#m",
      "selected_for_text": false,
      "notes": "guest-mode rss origin"
    }
  ],
  "content": {
    "primary_text_source": "x_post",
    "summary": "It’s now easier to find, reuse, and build on the files you upload and create in ChatGPT. You can quickly reference files in a chat using recent files in the toolbar, ask ChatGPT about something you’ve uploaded, or browse your files in the new Library tab in the web sidebar. Rolling out globally for Plus, Pro, and Business users, and coming soon to users in the EEA, Switzerland, and the UK.",
    "full_text": "Post title: It’s now easier to find, reuse, and build on the files you upload and create in ChatGPT. You can quickly reference files in a chat using recent files in the toolbar, ask ChatGPT about something you’ve uploaded, or browse your files in the new Library tab in the web sidebar. Rolling out globally for Plus, Pro, and Business users, and coming soon to users in the EEA, Switzerland, and the UK.\n\nPost summary: It’s now easier to find, reuse, and build on the files you upload and create in ChatGPT. You can quickly reference files in a chat using recent files in the toolbar, ask ChatGPT about something you’ve uploaded, or browse your files in the new Library tab in the web sidebar. Rolling out globally for Plus, Pro, and Business users, and coming soon to users in the EEA, Switzerland, and the UK.\n\nCanonical URL: https://x.com/OpenAI/status/2036183180219392103",
    "sections": [
      "x_post"
    ],
    "raw_quotes": [],
    "assembly_notes": null
  },
  "extracted_signals": {
    "release_signals": [],
    "metric_signals": [],
    "named_entities": [
      "It",
      "ChatGPT",
      "You",
      "Library",
      "Rolling",
      "Plus",
      "Pro",
      "Business",
      "EEA",
      "Switzerland",
      "UK",
      "Post",
      "Canonical URL",
      "OpenAI"
    ],
    "task_hints": [],
    "fact_anchors": [
      "It’s now easier to find, reuse, and build on the files you upload and create in ChatGPT. You can quickly reference files in a chat using recent files in the toolbar, ask ChatGPT about something you’ve uploaded, or browse your files in the new Library tab in the web sidebar. Rolling out globally for Plus, Pro, and Business users, and coming soon to users in the EEA, Switzerland, and the UK.",
      "It",
      "ChatGPT",
      "You",
      "Library",
      "Rolling",
      "Plus",
      "Pro",
      "Business",
      "EEA",
      "Switzerland",
      "UK",
      "Post",
      "Canonical URL",
      "OpenAI"
    ],
    "normalization_notes": "linked_context_count=0"
  }
}
