{
  "schema_version": "0.1.0",
  "source_id": "x-tualatrix-6d07307ba395",
  "fetched_at": "2026-03-25T07:23:48Z",
  "platform": "x",
  "source_kind": "x_thread",
  "canonical_url": "https://x.com/tualatrix/status/2036274266292048068",
  "author": {
    "handle": "@tualatrix",
    "display_name": "tualatrix",
    "account_url": "https://x.com/tualatrix"
  },
  "title": "这本《看不见的中东》又没看完，就要还给图书馆了，而中东已经发生了巨变。",
  "language": "unknown",
  "published_at": "2026-03-24T02:49:51Z",
  "participants": [],
  "source_assets": [
    {
      "asset_kind": "x_status",
      "url": "https://x.com/tualatrix/status/2036274266292048068",
      "selected_for_text": true,
      "notes": "primary social source"
    },
    {
      "asset_kind": "nitter_rss_item",
      "url": "https://nitter.net/tualatrix/status/2036274266292048068#m",
      "selected_for_text": false,
      "notes": "guest-mode rss origin"
    }
  ],
  "content": {
    "primary_text_source": "x_post",
    "summary": "这本《看不见的中东》又没看完，就要还给图书馆了，而中东已经发生了巨变。",
    "full_text": "Post title: 这本《看不见的中东》又没看完，就要还给图书馆了，而中东已经发生了巨变。\n\nPost summary: 这本《看不见的中东》又没看完，就要还给图书馆了，而中东已经发生了巨变。\n\nCanonical URL: https://x.com/tualatrix/status/2036274266292048068",
    "sections": [
      "x_post"
    ],
    "raw_quotes": [],
    "assembly_notes": null
  },
  "extracted_signals": {
    "release_signals": [],
    "metric_signals": [],
    "named_entities": [
      "Post",
      "Canonical URL"
    ],
    "task_hints": [],
    "fact_anchors": [
      "这本《看不见的中东》又没看完，就要还给图书馆了，而中东已经发生了巨变。",
      "Post",
      "Canonical URL"
    ],
    "normalization_notes": "linked_context_count=0"
  }
}
