{
  "schema_version": "0.1.0",
  "source_id": "x-astronaut_1216-878fe1d08987",
  "fetched_at": "2026-03-25T07:23:48Z",
  "platform": "x",
  "source_kind": "x_thread",
  "canonical_url": "https://x.com/Astronaut_1216/status/2036451871473193178",
  "author": {
    "handle": "@Astronaut_1216",
    "display_name": "Astronaut_1216",
    "account_url": "https://x.com/Astronaut_1216"
  },
  "title": "到底该如何评价张雪峰呢 下面这个它的自述我看了不下 10 遍 其实你所看到的下面这段话，包括这句，也完全是在我眼眶微微湿润的情况下，口喷的这些文字 该怎么说呢？它其实影响了我从风景园林离开，也影响了我对布道，教育这件事的看法 我认为好的教育、好的知识的分享，是一定能够带人走向一个相对正确的道路的 于是。我会想尽办法去和学校合作，想尽办法能够链接到一些土建类的大学生，告诉他们什么是真实的土木，告诉他们怎么样能够在 ai 的这一波浪潮下，能不浪费自己的专业 幸不辱命，有一些学生确确实实来跟我报喜了 关于我印象里的张雪峰 我印象特别深，那个时候我上高中，我妈就经常给我推一个讲相声的齐齐哈尔人。这个太讲相声，特别有意思，而且还是讲的单口 我说，那行啊，我也想听听，结果我才发现他是我最讨厌的教育类博主 到后面他开始做企业，做高考志愿填报的导师，我才真正的开始去了解他，了解他做企业的理念，了解他做教育的理念。当他说到他这辈子能够从角度做到逃离满天下我是真的觉得这个人 就两个字 牛逼 好了，张老师，要一直快乐啊！",
  "language": "unknown",
  "published_at": "2026-03-24T14:35:36Z",
  "participants": [],
  "source_assets": [
    {
      "asset_kind": "x_status",
      "url": "https://x.com/Astronaut_1216/status/2036451871473193178",
      "selected_for_text": true,
      "notes": "primary social source"
    },
    {
      "asset_kind": "nitter_rss_item",
      "url": "https://nitter.net/Astronaut_1216/status/2036451871473193178#m",
      "selected_for_text": false,
      "notes": "guest-mode rss origin"
    }
  ],
  "content": {
    "primary_text_source": "x_post",
    "summary": "到底该如何评价张雪峰呢 下面这个它的自述我看了不下 10 遍 其实你所看到的下面这段话，包括这句，也完全是在我眼眶微微湿润的情况下，口喷的这些文字 该怎么说呢？它其实影响了我从风景园林离开，也影响了我对布道，教育这件事的看法 我认为好的教育、好的知识的分享，是一定能够带人走向一个相对正确的道路的 于是。我会想尽办法去和学校合作，想尽办法能够链接到一些土建类的大学生，告诉他们什么是真实的土木，告诉他们怎么样能够在 ai 的这一波浪潮下，能不浪费自己的专业 幸不辱命，有一些学生确确实实来跟我报喜了 关于我印象里的张雪峰 我印象特别深，那个时候我上高中，我妈就经常给我推一个讲相声的齐齐哈尔人。这个太讲相声，特别有意思，而且还是讲的单口 我说，那行啊，我也想听听，结果我才发现他是我最讨厌的教育类博主 到后面他开始做企业，做高考志愿填报的导师，我才真正的开始去了解他，了解他做企业的理念，了解他做教育的理念。当他说到他这辈子能够从角度做到逃离满天下我是真的觉得这个人 就两个字 牛逼 好了，张老师，要一直快乐啊！ Video",
    "full_text": "Post title: 到底该如何评价张雪峰呢 下面这个它的自述我看了不下 10 遍 其实你所看到的下面这段话，包括这句，也完全是在我眼眶微微湿润的情况下，口喷的这些文字 该怎么说呢？它其实影响了我从风景园林离开，也影响了我对布道，教育这件事的看法 我认为好的教育、好的知识的分享，是一定能够带人走向一个相对正确的道路的 于是。我会想尽办法去和学校合作，想尽办法能够链接到一些土建类的大学生，告诉他们什么是真实的土木，告诉他们怎么样能够在 ai 的这一波浪潮下，能不浪费自己的专业 幸不辱命，有一些学生确确实实来跟我报喜了 关于我印象里的张雪峰 我印象特别深，那个时候我上高中，我妈就经常给我推一个讲相声的齐齐哈尔人。这个太讲相声，特别有意思，而且还是讲的单口 我说，那行啊，我也想听听，结果我才发现他是我最讨厌的教育类博主 到后面他开始做企业，做高考志愿填报的导师，我才真正的开始去了解他，了解他做企业的理念，了解他做教育的理念。当他说到他这辈子能够从角度做到逃离满天下我是真的觉得这个人 就两个字 牛逼 好了，张老师，要一直快乐啊！\n\nPost summary: 到底该如何评价张雪峰呢 下面这个它的自述我看了不下 10 遍 其实你所看到的下面这段话，包括这句，也完全是在我眼眶微微湿润的情况下，口喷的这些文字 该怎么说呢？它其实影响了我从风景园林离开，也影响了我对布道，教育这件事的看法 我认为好的教育、好的知识的分享，是一定能够带人走向一个相对正确的道路的 于是。我会想尽办法去和学校合作，想尽办法能够链接到一些土建类的大学生，告诉他们什么是真实的土木，告诉他们怎么样能够在 ai 的这一波浪潮下，能不浪费自己的专业 幸不辱命，有一些学生确确实实来跟我报喜了 关于我印象里的张雪峰 我印象特别深，那个时候我上高中，我妈就经常给我推一个讲相声的齐齐哈尔人。这个太讲相声，特别有意思，而且还是讲的单口 我说，那行啊，我也想听听，结果我才发现他是我最讨厌的教育类博主 到后面他开始做企业，做高考志愿填报的导师，我才真正的开始去了解他，了解他做企业的理念，了解他做教育的理念。当他说到他这辈子能够从角度做到逃离满天下我是真的觉得这个人 就两个字 牛逼 好了，张老师，要一直快乐啊！ Video\n\nCanonical URL: https://x.com/Astronaut_1216/status/2036451871473193178",
    "sections": [
      "x_post"
    ],
    "raw_quotes": [],
    "assembly_notes": null
  },
  "extracted_signals": {
    "release_signals": [],
    "metric_signals": [],
    "named_entities": [
      "Video Post",
      "Post",
      "Video Canonical URL"
    ],
    "task_hints": [],
    "fact_anchors": [
      "到底该如何评价张雪峰呢 下面这个它的自述我看了不下 10 遍 其实你所看到的下面这段话，包括这句，也完全是在我眼眶微微湿润的情况下，口喷的这些文字 该怎么说呢？它其实影响了我从风景园林离开，也影响了我对布道，教育这件事的看法 我认为好的教育、好的知识的分享，是一定能够带人走向一个相对正确的道路的 于是。我会想尽办法去和学校合作，想尽办法能够链接到一些土建类的大学生，告诉他们什么是真实的土木，告诉他们怎么样能够在 ai 的这一波浪潮下，能不浪费自己的专业 幸不辱命，有一些学生确确实实来跟我报喜了 关于我印象里的张雪峰 我印象特别深，那个时候我上高中，我妈就经常给我推一个讲相声的齐齐哈尔人。这个太讲相声，特别有意思，而且还是讲的单口 我说，那行啊，我也想听听，结果我才发现他是我最讨厌的教育类博主 到后面他开始做企业，做高考志愿填报的导师，我才真正的开始去了解他，了解他做企业的理念，了解他做教育的理念。当他说到他这辈子能够从角度做到逃离满天下我是真的觉得这个人 就两个字 牛逼 好了，张老师，要一直快乐啊！",
      "到底该如何评价张雪峰呢 下面这个它的自述我看了不下 10 遍 其实你所看到的下面这段话，包括这句，也完全是在我眼眶微微湿润的情况下，口喷的这些文字 该怎么说呢？它其实影响了我从风景园林离开，也影响了我对布道，教育这件事的看法 我认为好的教育、好的知识的分享，是一定能够带人走向一个相对正确的道路的 于是。我会想尽办法去和学校合作，想尽办法能够链接到一些土建类的大学生，告诉他们什么是真实的土木，告诉他们怎么样能够在 ai 的这一波浪潮下，能不浪费自己的专业 幸不辱命，有一些学生确确实实来跟我报喜了 关于我印象里的张雪峰 我印象特别深，那个时候我上高中，我妈就经常给我推一个讲相声的齐齐哈尔人。这个太讲相声，特别有意思，而且还是讲的单口 我说，那行啊，我也想听听，结果我才发现他是我最讨厌的教育类博主 到后面他开始做企业，做高考志愿填报的导师，我才真正的开始去了解他，了解他做企业的理念，了解他做教育的理念。当他说到他这辈子能够从角度做到逃离满天下我是真的觉得这个人 就两个字 牛逼 好了，张老师，要一直快乐啊！ Video",
      "Video Post",
      "Post",
      "Video Canonical URL"
    ],
    "normalization_notes": "linked_context_count=0"
  }
}
