{
  "schema_version": "0.1.0",
  "source_id": "x-runwayml-62f5263a3d75",
  "fetched_at": "2026-03-19T10:32:27Z",
  "platform": "x",
  "source_kind": "x_thread",
  "canonical_url": "https://x.com/runwayml/status/2032481759330263390",
  "author": {
    "handle": "@runwayml",
    "display_name": "Runway",
    "account_url": "https://x.com/runwayml"
  },
  "title": "Learn how to create your own Runway Character via the Runway API. And start bringing real-time video agents directly into your apps, products, websites and experiences. Get started at the link below.",
  "language": "unknown",
  "published_at": "2026-03-13T15:39:47Z",
  "participants": [],
  "source_assets": [
    {
      "asset_kind": "x_status",
      "url": "https://x.com/runwayml/status/2032481759330263390",
      "selected_for_text": true,
      "notes": "primary social source"
    },
    {
      "asset_kind": "nitter_rss_item",
      "url": "https://nitter.net/runwayml/status/2032481759330263390#m",
      "selected_for_text": false,
      "notes": "guest-mode rss origin"
    }
  ],
  "content": {
    "primary_text_source": "x_post",
    "summary": "Learn how to create your own Runway Character via the Runway API. And start bringing real-time video agents directly into your apps, products, websites and experiences. Get started at the link below. Video",
    "full_text": "Post title: Learn how to create your own Runway Character via the Runway API. And start bringing real-time video agents directly into your apps, products, websites and experiences. Get started at the link below.\n\nPost summary: Learn how to create your own Runway Character via the Runway API. And start bringing real-time video agents directly into your apps, products, websites and experiences. Get started at the link below. Video\n\nCanonical URL: https://x.com/runwayml/status/2032481759330263390",
    "sections": [
      "x_post"
    ],
    "raw_quotes": [],
    "assembly_notes": null
  },
  "extracted_signals": {
    "release_signals": [],
    "metric_signals": [],
    "named_entities": [
      "Learn",
      "Runway Character",
      "Runway API. And",
      "Get",
      "Video Post",
      "Post",
      "Video Canonical URL"
    ],
    "task_hints": [
      "tutorial"
    ],
    "fact_anchors": [
      "Learn how to create your own Runway Character via the Runway API. And start bringing real-time video agents directly into your apps, products, websites and experiences. Get started at the link below.",
      "Learn how to create your own Runway Character via the Runway API. And start bringing real-time video agents directly into your apps, products, websites and experiences. Get started at the link below. Video",
      "Learn",
      "Runway Character",
      "Runway API. And",
      "Get",
      "Video Post",
      "Post",
      "Video Canonical URL"
    ],
    "normalization_notes": "linked_context_count=0"
  }
}
