{
  "schema_version": "0.1.0",
  "source_id": "x-jxnlco-c762e1df0ab9",
  "fetched_at": "2026-03-25T07:23:48Z",
  "platform": "x",
  "source_kind": "x_thread",
  "canonical_url": "https://x.com/jxnlco/status/2036055453432459359",
  "author": {
    "handle": "@jxnlco",
    "display_name": "jxnlco",
    "account_url": "https://x.com/jxnlco"
  },
  "title": "Jet blue mint is the best NYC to SFO flight of all time. You can ask them to make you an iced latte when you wake up",
  "language": "unknown",
  "published_at": "2026-03-23T12:20:22Z",
  "participants": [],
  "source_assets": [
    {
      "asset_kind": "x_status",
      "url": "https://x.com/jxnlco/status/2036055453432459359",
      "selected_for_text": true,
      "notes": "primary social source"
    },
    {
      "asset_kind": "nitter_rss_item",
      "url": "https://nitter.net/jxnlco/status/2036055453432459359#m",
      "selected_for_text": false,
      "notes": "guest-mode rss origin"
    }
  ],
  "content": {
    "primary_text_source": "x_post",
    "summary": "Jet blue mint is the best NYC to SFO flight of all time. You can ask them to make you an iced latte when you wake up",
    "full_text": "Post title: Jet blue mint is the best NYC to SFO flight of all time. You can ask them to make you an iced latte when you wake up\n\nPost summary: Jet blue mint is the best NYC to SFO flight of all time. You can ask them to make you an iced latte when you wake up\n\nCanonical URL: https://x.com/jxnlco/status/2036055453432459359",
    "sections": [
      "x_post"
    ],
    "raw_quotes": [],
    "assembly_notes": null
  },
  "extracted_signals": {
    "release_signals": [],
    "metric_signals": [],
    "named_entities": [
      "Jet",
      "NYC",
      "SFO",
      "You",
      "Post",
      "Canonical URL"
    ],
    "task_hints": [],
    "fact_anchors": [
      "Jet blue mint is the best NYC to SFO flight of all time. You can ask them to make you an iced latte when you wake up",
      "Jet",
      "NYC",
      "SFO",
      "You",
      "Post",
      "Canonical URL"
    ],
    "normalization_notes": "linked_context_count=0"
  }
}
