{
  "schema_version": "0.1.0",
  "source_id": "x-bentossell-7fcc0e30da9d",
  "fetched_at": "2026-03-24T07:40:13Z",
  "platform": "x",
  "source_kind": "x_thread",
  "canonical_url": "https://x.com/bentossell/status/2035032960420757596",
  "author": {
    "handle": "@bentossell",
    "display_name": "bentossell",
    "account_url": "https://x.com/bentossell"
  },
  "title": "so that’s what a real glass agent GUI would look like 👀",
  "language": "unknown",
  "published_at": "2026-03-20T16:37:21Z",
  "participants": [],
  "source_assets": [
    {
      "asset_kind": "x_status",
      "url": "https://x.com/bentossell/status/2035032960420757596",
      "selected_for_text": true,
      "notes": "primary social source"
    },
    {
      "asset_kind": "nitter_rss_item",
      "url": "https://nitter.net/bentossell/status/2035032960420757596#m",
      "selected_for_text": false,
      "notes": "guest-mode rss origin"
    }
  ],
  "content": {
    "primary_text_source": "x_post",
    "summary": "so that’s what a real glass agent GUI would look like 👀 Arne Strickmann (@arnestrickmann) 🤔 — https://nitter.net/arnestrickmann/status/2035031830408437892#m",
    "full_text": "Post title: so that’s what a real glass agent GUI would look like 👀\n\nPost summary: so that’s what a real glass agent GUI would look like 👀 Arne Strickmann (@arnestrickmann) 🤔 — https://nitter.net/arnestrickmann/status/2035031830408437892#m\n\nCanonical URL: https://x.com/bentossell/status/2035032960420757596",
    "sections": [
      "x_post"
    ],
    "raw_quotes": [],
    "assembly_notes": null
  },
  "extracted_signals": {
    "release_signals": [],
    "metric_signals": [],
    "named_entities": [
      "GUI",
      "Arne Strickmann",
      "Post",
      "Canonical URL"
    ],
    "task_hints": [],
    "fact_anchors": [
      "so that’s what a real glass agent GUI would look like 👀",
      "so that’s what a real glass agent GUI would look like 👀 Arne Strickmann (@arnestrickmann) 🤔 — https://nitter.net/arnestrickmann/status/2035031830408437892#m",
      "GUI",
      "Arne Strickmann",
      "Post",
      "Canonical URL"
    ],
    "normalization_notes": "linked_context_count=0"
  }
}
