{
  "schema_version": "0.1.0",
  "source_id": "x-alchainhust-8a876cc0222c",
  "fetched_at": "2026-03-24T07:40:13Z",
  "platform": "x",
  "source_kind": "x_thread",
  "canonical_url": "https://x.com/AlchainHust/status/2036039233073459501",
  "author": {
    "handle": "@AlchainHust",
    "display_name": "AlchainHust",
    "account_url": "https://x.com/AlchainHust"
  },
  "title": "经常有刚开始经营自媒体不久的同学来问我该怎么给自己的账号报价，然后想找我了解我的情况，以及想知道行业基准水平是什么样的。 说实话，我基本上从来没了解过行业是如何的，我建议的定价逻辑只有一个：那就是为自己的时间定一个能让自己满意的高价，然后努力让自己配得上它。 就这么简单～",
  "language": "unknown",
  "published_at": "2026-03-23T11:15:55Z",
  "participants": [],
  "source_assets": [
    {
      "asset_kind": "x_status",
      "url": "https://x.com/AlchainHust/status/2036039233073459501",
      "selected_for_text": true,
      "notes": "primary social source"
    },
    {
      "asset_kind": "nitter_rss_item",
      "url": "https://nitter.net/AlchainHust/status/2036039233073459501#m",
      "selected_for_text": false,
      "notes": "guest-mode rss origin"
    }
  ],
  "content": {
    "primary_text_source": "x_post",
    "summary": "经常有刚开始经营自媒体不久的同学来问我该怎么给自己的账号报价，然后想找我了解我的情况，以及想知道行业基准水平是什么样的。 说实话，我基本上从来没了解过行业是如何的，我建议的定价逻辑只有一个：那就是为自己的时间定一个能让自己满意的高价，然后努力让自己配得上它。 就这么简单～",
    "full_text": "Post title: 经常有刚开始经营自媒体不久的同学来问我该怎么给自己的账号报价，然后想找我了解我的情况，以及想知道行业基准水平是什么样的。 说实话，我基本上从来没了解过行业是如何的，我建议的定价逻辑只有一个：那就是为自己的时间定一个能让自己满意的高价，然后努力让自己配得上它。 就这么简单～\n\nPost summary: 经常有刚开始经营自媒体不久的同学来问我该怎么给自己的账号报价，然后想找我了解我的情况，以及想知道行业基准水平是什么样的。 说实话，我基本上从来没了解过行业是如何的，我建议的定价逻辑只有一个：那就是为自己的时间定一个能让自己满意的高价，然后努力让自己配得上它。 就这么简单～\n\nCanonical URL: https://x.com/AlchainHust/status/2036039233073459501",
    "sections": [
      "x_post"
    ],
    "raw_quotes": [],
    "assembly_notes": null
  },
  "extracted_signals": {
    "release_signals": [],
    "metric_signals": [],
    "named_entities": [
      "Post",
      "Canonical URL",
      "AlchainHust"
    ],
    "task_hints": [],
    "fact_anchors": [
      "经常有刚开始经营自媒体不久的同学来问我该怎么给自己的账号报价，然后想找我了解我的情况，以及想知道行业基准水平是什么样的。 说实话，我基本上从来没了解过行业是如何的，我建议的定价逻辑只有一个：那就是为自己的时间定一个能让自己满意的高价，然后努力让自己配得上它。 就这么简单～",
      "Post",
      "Canonical URL",
      "AlchainHust"
    ],
    "normalization_notes": "linked_context_count=0"
  }
}
