{
  "schema_version": "0.1.0",
  "source_id": "x-zeng_wt-afb738054e1d",
  "fetched_at": "2026-03-25T07:23:48Z",
  "platform": "x",
  "source_kind": "x_thread",
  "canonical_url": "https://x.com/zeng_wt/status/2036616342540038542",
  "author": {
    "handle": "@zeng_wt",
    "display_name": "zeng_wt",
    "account_url": "https://x.com/zeng_wt"
  },
  "title": "I am dead. 😵‍💫",
  "language": "unknown",
  "published_at": "2026-03-25T01:29:09Z",
  "participants": [],
  "source_assets": [
    {
      "asset_kind": "x_status",
      "url": "https://x.com/zeng_wt/status/2036616342540038542",
      "selected_for_text": true,
      "notes": "primary social source"
    },
    {
      "asset_kind": "nitter_rss_item",
      "url": "https://nitter.net/zeng_wt/status/2036616342540038542#m",
      "selected_for_text": false,
      "notes": "guest-mode rss origin"
    }
  ],
  "content": {
    "primary_text_source": "x_post",
    "summary": "I am dead. 😵‍💫 Nikita Bier (@nikitabier) Starting Thursday, we'll be updating our revenue sharing incentives to better reward the content we want on X: We will be giving more weight to impressions from your home region—to encourage content that resonates with people in your country, in neighboring countries and people who speak your language. While we appreciate everyone's opinion on American politics, we hope this will disincentivize gaming the attention of US or Japanese accounts and instead, drive diverse conversations on the platform. We invite creators to start building an audience locally. X will be a much richer community when there's relevant posts for people in all parts of the world. — https://nitter.net/nikitabier/status/2036603028619534564#m",
    "full_text": "Post title: I am dead. 😵‍💫\n\nPost summary: I am dead. 😵‍💫 Nikita Bier (@nikitabier) Starting Thursday, we'll be updating our revenue sharing incentives to better reward the content we want on X: We will be giving more weight to impressions from your home region—to encourage content that resonates with people in your country, in neighboring countries and people who speak your language. While we appreciate everyone's opinion on American politics, we hope this will disincentivize gaming the attention of US or Japanese accounts and instead, drive diverse conversations on the platform. We invite creators to start building an audience locally. X will be a much richer community when there's relevant posts for people in all parts of the world. — https://nitter.net/nikitabier/status/2036603028619534564#m\n\nCanonical URL: https://x.com/zeng_wt/status/2036616342540038542",
    "sections": [
      "x_post"
    ],
    "raw_quotes": [],
    "assembly_notes": null
  },
  "extracted_signals": {
    "release_signals": [],
    "metric_signals": [],
    "named_entities": [
      "Nikita Bier",
      "Starting Thursday",
      "We",
      "While",
      "American",
      "US",
      "Japanese",
      "Post",
      "Canonical URL"
    ],
    "task_hints": [],
    "fact_anchors": [
      "I am dead. 😵‍💫",
      "I am dead. 😵‍💫 Nikita Bier (@nikitabier) Starting Thursday, we'll be updating our revenue sharing incentives to better reward the content we want on X: We will be giving more weight to impressions from your home region—to encourage content that resonates with people in your country, in neighboring countries and people who speak your language. While we appreciate everyone's opinion on American politics, we hope this will disincentivize gaming the attention of US or Japanese accounts and instead, drive diverse conversations on the platform. We invite creators to start building an audience locally. X will be a much richer community when there's relevant posts for people in all parts of the world. — https://nitter.net/nikitabier/status/2036603028619534564#m",
      "Nikita Bier",
      "Starting Thursday",
      "We",
      "While",
      "American",
      "US",
      "Japanese",
      "Post",
      "Canonical URL"
    ],
    "normalization_notes": "linked_context_count=0"
  }
}
